index,video_id,title,url,duration,upload_date
1,KH49Ws90TmA,New Rules for Tech: Two Sigma’s David Siegel | STYT,https://www.youtube.com/watch?v=KH49Ws90TmA,23:23,
2,S-iO6_wvizE,Two Sigma’s Siegel Sees Tech Negatives for ‘Human Experience’,https://www.youtube.com/watch?v=S-iO6_wvizE,20:55,
3,LMyXUnQEqoY,Two Sigma's Siegel on Tech in Society,https://www.youtube.com/watch?v=LMyXUnQEqoY,21:26,
4,09xFhq7Tpm4,"Homeroom with Sal & David Siegel - Wednesday, July 14",https://www.youtube.com/watch?v=09xFhq7Tpm4,31:29,
5,rdSq8IWxl_Y,When haystacks keep moving: Harnessing accuracy in data landscape / The Buttonwood Gathering,https://www.youtube.com/watch?v=rdSq8IWxl_Y,38:33,
6,cfojlUq0-Hw,MIT Quest for Intelligence Launch: Introduction,https://www.youtube.com/watch?v=cfojlUq0-Hw,17:23,
7,8gRCdtNzU2g,【2021 數碼港創業投資論壇】主席對談：科技革新人類體驗,https://www.youtube.com/watch?v=8gRCdtNzU2g,22:18,
8,h-UOl5H5WMo,Digitizing Wall Street: How Technology Is Changing the Future of Finance,https://www.youtube.com/watch?v=h-UOl5H5WMo,1:00:56,
